"#","Outage Date","Site ID","Site Name","Outage Start","Outage End","Alarm Before Down (h)","Outage Duration (h)","ETA (min)","Passive/Active","RCA","Resolution Comment","Fuel Outage","TRB Ref"
"2","17-juil.-2026","DRKN0246","Kimpese","17/07/2026 05:09:11","17/07/2026 06:01:00","1,92","0,87","25","Passive","Batterie de démarrage Faulty","Usage de la batterie de secours","Non","TRB1389131"
"2","17-juil.-2026","DRKN0221","Herady","17/07/2026 09:54:14","17/07/2026 10:22:00","0,83","0,47","25","Passive","La DSE a détecté une Séquence de phases inversée","Arrêt du DG (Shutdown).","Non","TRB1388223"
"3","17-juil.-2026","DRKN2164","Malueka","17/07/2026 15:12:12","17/07/2026 15:26:00","0,92","0,23","35","Passive","4/6 Module rectifier faulty","4 Module rectifier remplacé","Non","TRB1389355"
"4","17-juil.-2026","DRKN0064","Sola","17/07/2026 15:37:45","17/07/2026 16:59:00","0","1,37","30","Passive","Tenant Airtel Overload calibre 100A Load 113A","CB enclencher","Non","TRB1389378"
"5","17-juil.-2026","DRKN2193","Mitendi","17/07/2026 18:59:34","17/07/2026 19:55:00","0,67","0,93","30","Passive","La pompe d'injection tire faiblement, ce qui a généré une alarme de DG fail to start","Le DG a été démarré de manière forcée","Non","TRB1389417"
"6","17-juil.-2026","DRKN8147","Malueka_Nkotila","17/07/2026 19:53:30","17/07/2026 20:44:00","0","0,85","25","Passive","CB Switch off  Tenant Airtel Overload 100 A  atteint le 144A","Enclenchement manuel du CB","Non","TRB1389454"
"7","17-juil.-2026","DRKN0753","Tshikapa Ngombe","17/07/2026 23:56:31","18/07/2026 00:07:00","0,83","0,18","30","Passive","bbu mal chargee","site sous grid","Non","TRB1389531"
"8","17-juil.-2026","DRKN0699","Boboliko","17/07/2026 20:41:47","17/07/2026 23:40:00","0","2,99","20","Passive","Hightemps dans la bbs  causé par les deux fans d'extraction d'air chaud qui ne fonctionnent pas. Ce qui coupe le CB Vodacom dans la bbs","Enclenchement manuel du CB","Non","TRB1389473"
